Clinical Vignettes,Rationale,acuity
"“My dentist can’t see me until Monday, and my tooth is  killing  me.  Can’t  you  give  me something for the pain?” a healthy 38-year-old male asks the triage nurse. He tells you the pain started yesterday, and  he  rates  his  pain  as 10/10. No obvious facial swelling  is  noted. Allergic to penicillin. Vital signs:  T  99.8˚F,  HR 78, RR 16, BP 128/74.","ESI level 5. No resources. No resources should be necessary. He will require a physical exam, but without signs of an abscess or cellulitis, this patient will be referred to a dentist. In the ED, he may be given oral medications and prescriptions for antibiotics and/or pain medication. He is not an ESI level 2, even though he rates his pain as 10/10. Based on the triage assessment, he would not be given the last open bed.",5
"“I have been on antibiotics for  5  days  for mastitis.  I am continuing to nurse  my baby,  but   I still have pain and tenderness in  my  right breast. Now there is this new reddened area,” a 34-year-old new mother tells you. The patient reports having a fever, chills, and just feeling run down. T 102.2˚F, RR 20, HR 990, BP 122/80, SpO2 98%. Pain 6/10.","ESI level 3: Two or more resources. This patient probably has been on antibiotics for 5 days for mastitis and now presents to the ED due to fever, chills, and feeling rundown. She will require labs, IV antibiotics, a lactation consult if available, and perhaps admission.",3
"A young male walks into triage and tells you that he has been shot. As he rolls up the left leg of his shorts, you notice two wounds. He tells you that he heard three shots. He is alert and responding appropriately to questions. Initial Vital signs: T 98.2˚ F, HR 78, RR 16, BP 118/80.","ESI  level  2:  High-risk   situation.  This patient has two obvious wounds, but until he is thoroughly examined in the trauma room, you can’t rule out the possibility that he has another gunshot wound. The wounds on his thigh look non-life-threatening, but a bullet could have nicked a blood vessel or other structure; therefore, he meets ESI level-2 criteria. His vital signs are within normal limits, so he does not meet ESI level-1 criteria.",2
"An 82-year-old resident of a local assisted living facility called 911 because of excruciating generalized abdominal pain and vomiting that started a few hours ago. The woman is moaning in pain but is still  able to tell you that she had  a heart attack 6 years ago. Vital signs: T 98˚F, RR 28, HR 102, BP 146/80, SpO2 98%. Pain 10/10.","ESI  level   2:  High  risk  and  severe   pain and distress. Abdominal pain in the elderly can be indicative of a serious medical condition, and a pain score of 10/10 is significant. The triage nurse needs to keep in mind that due to the normal changes of aging, the elderly patient may present very differently than a younger patient and is more likely to present with vague symptoms.",2
"""I should have paid more attention to what I was doing,” states a 37-year-old carpenter who presents to the ED with a 3-centimeter laceration to his right thumb. The thumb is wrapped in a clean rag. “I know I need a tetanus shot,” he tells you. BP 142/76, RR 16,  T 98.6˚F.",ESI level 4: One resource. This patient will require a laceration repair. A tetanus booster is not a resource.,4
"“How long am I going to have to wait before I see a doctor?” asks a 27-year-old female with a migraine. The patient is well known to you and your department. She rates her pain as 20/10 and tells you that she has been like this for 2 days. She vomited twice this morning. past medical history: migraines, no allergies, medications include Fioricet.","ESI level 3: Two or more resources. At a minimum, this patient will require an IV with fluid, IV pain medication, and an antiemetic. Although she rates her pain as 20/10, she should not be assigned to ESI level 2. She has had the pain for 2 days, and the triage nurse can’t justify giving the last open bed to this patient. The triage nurse will need to address this patient’s concerns about wait time.",3
"EMS arrives with a 75-year-old male with a self- inflicted 6-centimeter laceration to his neck. Bleeding is currently controlled. With tears in his eyes, the patient tells you that his wife of 56 years died last week. Health, No known drug allergies, baby ASA per day, BP 136/82, HR 74, RR 18, SpO2, 98% RA.","ESI level 2: High-risk. This 75-year-old male tried to kill himself by cutting his throat. Because of the anatomy of the neck, this type of laceration has the potential to cause airway, breathing, and/or circulation problems. At the same time, he is suicidal, and the ED needs to ensure that he does not leave or attempt to harm himself further.",2
"“My mother is just not acting herself,” reports the daughter of a 72-year-old female. She is sleeping more than usual and complains that it hurts to pee.” Vital signs: T 100.8˚F, HR 98, RR 22, BP 122/80. The patient responds to verbal stimuli but is disoriented to time and place.","ESI  level  2:  New  onset  confusion, lethargy, or disorientation. The daughter reports that her mother has a change in level of consciousness. The reason for her change in mental status may be a UTI that has advanced to bacteremia. She has an acute change in mental status and is therefore high risk.",2
"EMS arrives in the ED with a 57-year-old female with multiple sclerosis. She is bedridden, and her family provides care in the home.  The family called 911 because her Foley catheter came out this morning. No other complaints. Vital signs are within normal range, currently on antibiotics for a UTI.","ESI level 4: One resource. The patient was brought to the emergency department for a new Foley catheter – one resource. There are no other changes in her condition, and she is already on antibiotics for a UTI, so no further evaluation is needed.",4
"“Why the hell don’t you just leave me alone?” yells a 73-year-old disheveled male who was brought to the ED by EMS. He was found sitting on the curb drinking a bottle of vodka with blood oozing from a 4-centimeter  forehead laceration. He is oriented to person, place, and time and has a Glasgow Coma Scale score of 14.","ESI level  2:  High-risk  situation.  The history of events is unclear. How did the 73- year-old gentleman get the laceration on his forehead? Did he fall? Get hit? Because of his age, presentation, and presence of alcohol, he is at risk for a number of complications.",2
"“This is so embarrassing,” reports a 42-year-old male. “We were having incredible sex, and I heard a crack. Next thing you know, my penis was flaccid, and I noticed some bruising.” The pain is “unbelievable,” 20/10. No meds, No known drug allergies.","ESI level 2: High risk. This patient may be describing a penile fracture, a medical emergency. It is most often caused by blunt trauma to an erect penis. This patient needs to be evaluated promptly.",2
"A 72-year-old female with obvious chronic obstructive pulmonary disease and increased work of breathing is wheeled into triage. Between breaths, she tells you that she “is having a hard time breathing and has had a fever since yesterday.” The SpO2 monitor is alarming and displaying a saturation of 79 percent.","ESI  level  1:  Requires   immediate lifesaving intervention.   Immediate aggressive airway management is what this patient requires. Her saturation is very low, and she appears to be tiring. The triage nurse does not need the other vital signs in order to decide that this patient needs immediate care.",1
"“I think I need a tetanus shot,” a 29-year-old female tells you. “I stepped on a rusty nail this morning, and I know I haven’t had one for years.” No past medical history, No known drug allergies, no medications.",ESI level 5: No resources. A tetanus immunization does not count as a resource. The patient will be seen by a physician or midlevel provider and receive a tetanus immunization and discharge instructions. This patient will require no resources.,5
A 63-year-old cachectic male is brought in from the local nursing  home because his feeding tube fell out again. The patient is usually unresponsive. He has been in the nursing home since he suffered a massive stroke about 4 years ago.,"ESI level 4: One  resource. This patient  will be sent back to the nursing home after the feeding tube is reinserted. There is no acute change in his medical condition that warrants any further evaluation. He is unresponsive, but that is the patient’s baseline mental status so he is not an ESI level 1.",4
"A 28-year-old male presents to the ED requesting to be checked. He has a severe shellfish allergy and mistakenly ate a dip that contained shrimp. He immediately felt his throat start to close, so he used his EpiPen. He tells you that he feels okay. No wheezes or rash noted. Vital signs: BP 136/84, HR 108, RR 20, SpO2 97%, T 97˚F.",ESI level  2:  High-risk  situation  for allergic reaction. The patient has used his EpiPen but still requires additional medications and close monitoring.,2
"“He was running after his brother, fell, and cut his lip on the corner of the coffee table. There was blood everywhere,” recalls the mother of a healthy 19-month-old. “He’ll never stay still for the doctor.” You notice that the baby has a 2- centimeter lip laceration that extends through the vermilion border. Vital signs are within normal limits for age.","ESI level 3: Two or more resources. A laceration through the vermilion border requires the physician to line up the edges exactly. Misalignment can be noticeable. A healthy 19-month-old will probably not cooperate. In most settings, he will require conscious sedation, which counts as two resources. The toddler’s vital signs are within normal limits for his age, so there is no reason to up-triage to ESI level 2.",3
"A 44-year-old female is retching continuously into a large basin as her son wheels her into the triage area. Her son tells you that his diabetic mother has been vomiting for the past 5 hours, and now it is “just this yellow stuff.” “She hasn’t eaten or taken her insulin,” he tells you. No known drug allergies. Vital signs: BP 148/70, P 126, RR 24.","ESI level 2: High risk. A 44-year-old diabetic with continuous vomiting is at risk for diabetic ketoacidosis. The patient’s vital signs are a concern, as her heart rate and respiratory rate are both elevated. It is not safe for this patient to wait for an extended period of time in the waiting room",2
"EMS arrives with a 76-year-old male found on the bathroom floor. The  family  called  911 when they heard a loud crash in the bathroom. The patient was found in his underwear, and the toilet bowl was filled with maroon-colored stool. Vital signs on arrival: BP 70/palp, HR 128, RR 40. His family tells you he has a history of atrial fibrillation and takes a “little blue pill to thin his blood.”","ESI  level  1:  Requires  immediate lifesaving intervention. This 76-year-old patient is in hemorrhagic shock from his GI bleed. His blood pressure is 70, his heart rate is 128, and his respiratory rate is 40, all indicating an attempt to compensate for his blood loss. This patient needs immediate IV access and the administration of fluid, blood, and medications.",1
"I think I picked up a bug overseas,” reports a 34-year-old male who presented in the emergency department complaining of frequent watery stools and abdominal cramping. “I think I am getting dehydrated.” T 98°F, RR 22, HR 112, BP 120/80, SpO2 100%. His lips are dry and cracked. ","ESI level 3: Two or  more  resources.  From the patient’s history, he will require labs and IV fluid replacement—two resources.",3
"“My pain medications are not working anymore. Last night I couldn’t sleep because the pain was so bad,” reports a 47-year-old female with metastatic ovarian cancer. “My husband called my oncologist, and he told me to come to the emergency department.” The patient rates her pain as 9/10. Vital signs are within normal limits.",ESI level 2: Severe pain or distress. This patient needs aggressive pain management with IV medications. There is nothing the triage nurse can do to decrease the patient’s pain level. The answer to “Would you give your last open bed to this patient?” should be yes.,2
"A 48-year-old male tells you that he has a history of kidney stones and thinks he has another one. He has right costovertebral angle pain that radiates around to the front and into his groin. He is nauseous but tells you he took a pain pill, and right now he has minimal pain. He denies vomiting. T 98°F, RR 16, HR 80, BP 136/74, SpO2 100%. Pain 3/10.","ESI level 3: Two or more resources.  The patient is presenting with signs and symptoms of another kidney stone. At a minimum, he will need a urinalysis and CT scan. If his pain increases, he may need IV pain medication. At a minimum, two resources are required. If the pain level was 7/10 or greater and the triage nurse could not manage the pain at triage, the patient could meet level-2 criteria.",3
"A 46-year-old asthmatic in significant respiratory distress presents via ambulance. The paramedics report that the patient began wheezing earlier in the day and had been using her inhaler with no relief. On her last  admission for asthma, she was intubated. Vital signs: RR 44, SpO2 93% on room air, HR 98, BP 154/60. The patient is able to answer your questions about allergies and medications.","ESI level 2: High-risk. An asthmatic with a prior history of intubation is a high-risk situation. This patient is in respiratory distress as evidenced, by her respiratory rate, oxygen saturation, and work of breathing. She does not meet the criteria for ESI level 1, requires immediate lifesaving intervention.",2
"A 56-year-old male with a recent diagnosis of late-stage non-Hodgkin’s lymphoma was brought to the ED from the oncology clinic. He told his oncologist that he had facial and bilateral arm swelling and increasing shortness of breath. The patient also reports that his symptoms are worse if he lies down. Vital signs: BP 146/92, HR 122, RR 38, SpO2 98% on room air, temperature normal.","ESI level 2: High risk. This patient is demonstrating respiratory distress with his increased respiratory rate and decreased oxygen saturation. Symptoms are caused by compression of the superior vena cava from the tumor. It is difficult for blood to return to the heart, causing edema of the face and arms",2
"EMS arrives with an 87-year-old male who slipped on the ice and injured his right hip. His right leg is shortened and externally rotated. The patient’s only complaint is hip pain. He rates his pain as 5/10, and his vital signs are within normal limits.","ESI level 3: Two or more resources. This patient probably has a fractured hip and will need an x ray, IV pain medication, and an orthopedic consult. If the reason for a fall in the elderly is unclear, the patient should be assigned ESI level 2 to rule out a cardiac or neurological event.",3
"A 72-year-old female is brought in by  ambulance from the nearby nursing home.  They report that she has become increasingly confused over the last 24 hours. She is usually awake, alert, and oriented and takes care of her own activities of daily living. At triage she has a temperature of 99.6°F, HR 86, RR 28, BP 136/72, SpO2 94% on room air.",ESI level 2: High risk.  An  elderly  patient with increasing confusion and a fever needs to be evaluated for an infection. UTIs and pneumonia need to be ruled out. This patient may be septic and requires rapid evaluation and treatment.,2
"The overhead page announces the arrival of the Code STEMI. Paramedics arrive with a 62-year- old male with a history of a myocardial infarction 4 years ago who is complaining of chest pressure that started an hour ago. The field EKG shows anterior lateral ischemic changes. Currently, the patient’s heart rate is 106, RR 28, BP 72/53, SpO2 is 95% on a non- rebreather mask. His skin is cool and clammy.","ESI  level  1:   Requires   immediate lifesaving intervention. This patient is experiencing another cardiac event that requires immediate treatment. His vital signs and skin perfusion are suggestive of cardiogenic shock, and the patient may require fluid resuscitation or vasopressors to treat hypotension.",1
"“I had a knee replacement 3 months ago. Now look at it!” states a 64-year-old male. The knee is red, swollen and tender to touch. Vital signs: T 99°F, RR 20, HR 74, BP 164/74, SpO2 97%. Pain 6/10.","ESI level 3: Two or more resources. The patient is presenting with signs and symptoms of an infection. At a minimum, he will require labs, an x ray, an orthopedic consult, and IV antibiotics.",3
"EMS arrives with a 67-year-old female who lives alone. The patient called 911 because she was too sick to get herself to the doctor. The patient has had a fever and cough for 3 days. She reports coughing up thick green phlegm and is concerned that she has pneumonia. She denies shortness of breath. Past medical history HTN, T 102°F, RR 28, HR 86, BP 140/72, SpO2 94%.","ESI level 3: Two or more resources. This elderly patient may have pneumonia. Labs and a chest x ray are required, in addition to IV antibiotics. If vital signs are outside the accepted parameters, they may be considered high risk and meet ESI level-2 criteria.",3
"“I woke up this morning, and there was a bat flying around our bedroom. Scared me half to death, and now I am so worried about rabies,”  an anxious 48-year-old female tells you. “My husband opened the window, and the bat flew out.” Past medical history of ovarian cysts, no med or allergies, vital signs are within normal limits.","ESI level 4: One resource. It is unknown whether the patient was bitten by the bat because they were sleeping, so postexposure prophylaxis will be initiated. One resource—an intramuscular medication.",4
"The family of a 74-year-old male called 911 when he developed severe mid-abdominal pain. “My husband is not a complainer,” reports his wife. “The only medication he takes is for high blood pressure.” On arrival in the ED, the patient’s HR is 140, RR 28, SpO2 94%, BP 72/56.","ESI level 1: The patient is presenting with signs of shock, hypotension tachycardia, and tachypnea. He has a history of HTN and is presenting with signs and symptoms that could be suggestive of a dissecting aortic abdominal aneurysm. On arrival in the emergency department, he will require immediate lifesaving interventions such as immediate IV access, aggressive fluid resuscitation, and perhaps blood prior to surgery.",1
"“I woke up this morning, and my eyes are all  red and crusty,” reports a 29-year-old kindergarten teacher. “I think I got it from the kids at school,” she tells you. She denies pain or other visual disturbances. Her vital signs are within normal limits.","ESI level 5: No resources. Following a physical exam, this patient will be discharged to home with a prescription and appropriate discharge instructions. No resources are required.",5
"“I have this skin rash in my crotch. It looks like jock rot. Probably got it from not washing my gym clothes,” reports a 19-year-old healthy male. No abnormal vital signs.","ESI level 5: No resources. Following a physical exam, this young man will be discharged to home with a prescription and appropriate discharge instructions.",5
"“The doctor told me to come back this morning and have my boil checked. He lanced it yesterday and packed some stuff in it. He said he just want to make sure it is healing OK,” reports a 54-year-old diabetic male. The patient goes on to tell you that he feels so much better. T 98°F, RR 16, HR 64, BP 142/78, SpO2 98%. Pain 2/10.","ESI level 5: No resources. This patient was instructed to come back to the emergency department for a wound check. He will be examined and discharged to home. No resources are required. A point-of-care finger stick glucose is indicated, but this is not a resource. If the patient came back with a fever or increasing pain and redness, then his ESI level would reflect the additional resources he would require.",5
"“I have been wheezing for a few days, and  today I woke up with a fever. My rescue inhaler doesn’t seem to be helping,” reports a 43-year- old female with a past history of asthma. Vital signs: T 101.4°F, RR 26, HR 90, BP 138/70, SpO2 95%.","ESI level 3: Two or more resources. This patient has a history of asthma that is not responding to her rescue inhaler. In addition, she has a fever. At a minimum, she will need two resources: hand-held nebulizer treatments and a chest x ray.",3
"“I was having breakfast with my wife, and all of a sudden I couldn’t see out of my right eye. It lasted about 5 minutes. I’m just scared because I’ve never had anything like this happen  before,” reports a 56-year-old male with a history of HTN and high cholesterol.","ESI level 2: High risk. This patient is exhibiting signs of central retinal artery occlusion, which represents an acute threat to loss of vision. Rapid evaluation is necessary.",2
"“I was walking down the street and twisted my ankle as I stepped off the curb. I don’t think it’s broken, but it hurts so much,” report a 43-year- old female with a history of colitis. Vital signs:  T 98°F, HR 72, RR 18, BP 134/80, SpO2 100%. Pain 8/10.","ESI level 4: One resource. To rule out a fracture, this patient will require an x ray, one resource. The application of a splint and crutch walking instructions are not counted as resources. This patient does not meet the criteria for ESI level 2 for pain because nursing can immediately initiate interventions to address her pain.",4
"“My colitis is acting up,” report a 26-year-old female. “It started with an increased number of stools, and now I am cramping a lot. My gastroenterologist told me to come to the emergency department to be evaluated.” No other past medical history. T 97°F, RR 18, HR 68, BP 112/76, SpO2 100%. Pain 6/10.","ESI level 3: Two or more resources.  The patient is presenting with a colitis flare. She will need labs and possibly an IV and a CT of the abdomen, especially in light of her presentation with normal vital signs. Two resources.",3
"A 46-year-old female with a history of sickle cell disease presents to the emergency department because of a crisis. She has pain in her lower legs that began 8 hours ago, and the pain medication she is taking is not working. Currently, she rates her pain as 8/10. She has no other medical problems, and her current medications include folate and vicodin. Vital signs are all within normal limits.","ESI level 2: High risk. Sickle cell disease requires immediate medical attention because of the severity of the patient’s pain, which is caused by the sickle cells occluding small and sometimes large blood vessels. Rapid analgesic management will help prevent the crisis from progressing to the point where hospitalization will be unavoidable.",2
"“I take a blood thinner because I have had clots in my legs,” reports a 54-year-old black male. “They told me that medicine would prevent them, but today I have pain and swelling in my lower leg. It started out just being sore, but now I can hardly walk on it.” Denies any other complaints. Vital signs within normal limits.",ESI level 3: Two or more resources. This patient will need lab tests and lower-extremity vascular studies to rule out a deep vein thrombosis.,3
"A 65-year-old female is brought in by ambulance from the local nursing home for replacement of her PEG tube. The information from the nursing home states that she had a massive stroke 3 years ago and is now aphasic. Her condition is unchanged, and she is a do not resuscitate/do not intubate. Vital signs within normal limits.",ESI level 3: Two or more resources. This patient will need to be seen by surgery or GI and her PEG tube reinserted—two resources.,3
"26-year-old female presents to the ED because she can’t get an appointment  with  her therapist. She went home for the holidays, and the visit brought back many issues from her childhood. She is unable to sleep and has been drinking more than usual. She admits to thinking about hurting herself but has no plan. History of previous suicide attempts. Vital signs within normal limits.",ESI level 2: High-risk situation.  This patient is a danger to herself and needs to be placed in a safe environment with a constant observer.,2
"“I am here on business for a week, and I forgot to pack my blood pressure  medication.  I haven’t taken it for 2 days. Do you think one of the doctors will write me a prescription?” asks a 58-year-old male. BP 154/88, HR 64, RR 18, T 98°F, SpO2 99%.",ESI level 5: No resources. The patient  will need a history and physical exam and then will be discharged to home with a prescription. An oral dose of his blood pressure medication does not count as a resource.,5
"“I fell running for the bus,” reports a 42-year- old female. “Nothing hurts, I just have road burn on both my knees, and I think I need a tetanus booster.” Vital signs within normal limits.","ESI level 5: No resources. A tetanus booster is not a resource, and neither is cleaning and dressing abrasions.",5
"EMS radios in that they are in route with a 21- year-old with a single gunshot wound to the left chest. Vital signs are BP 78/palp, HR 148, RR 36, SpO2 96% on a non-rebreather.","ESI  level  1:  Requires  immediate lifesaving intervention. The trauma team needs to be in the trauma room and ready to aggressively manage this 21-year-old with a single gunshot wound to the left chest. He will require airway management, fluid resuscitation and, depending on the injury, a chest tube or rapid transport to the operating room.",1
